company_name,province,location,size,nature,business,page_num
杭州宇裳服饰有限公司,浙江,浙江杭州,1 - 49人,私营．民营企业,女装,31
亚奇世（深圳）文化发展有限公司,广东,广东深圳,,,,31
西安创意文化传播有限公司,陕西,陕西西安,,,"婚纱礼服,男装,女装,运动休闲,职业装",31
杭州佰思易电子商务有限公司,浙江,浙江杭州,,,,31
富丽达,浙江,浙江杭州,,,女装,31
杭州蒙赞家纺有限公司,浙江,浙江杭州,,,,31
神马三师弟服装有限公司,广东,广东广州,,,,32
上海太切迤贩饰有限公司,上海,上海,,,"男装,女装,童装",32
广州瑞合服装有限公司,广东,广东广州,100 - 499人,其它,"男装,其他",32
广州灵珊李服饰有限公司,广东,广东广州,50 - 99人,私营．民营企业,女装,32
深圳市阔太电子商务有限公司,广东,广东深圳,,,"女装,毛衫针织,皮革,其他,正装",32
亚联集团控股有限公司,山东,山东潍坊,100 - 499人,外商独资．外企办事处,"职业装, 毛衫针织",32
廉匠辰曲服装设计有限公司,广东,广东深圳,,,,32
广州埃瑟奎尔商贸有限公司,广东,广东广州,,,男装,32
湖南德注文化传媒,湖南,湖南长沙,1 - 49人,私营．民营企业,女装,32
中山市广雅运动商贸有限公司,广东,广东中山,100 - 499人,外商独资．外企办事处,,32
广州艾莉儿服饰有限公司,广东,广东广州,50 - 99人,私营．民营企业,女装,33
北京艾莎伯蒂国际贸易有限公司,北京,北京,,,女装,33
每色服饰,四川,四川成都,50 - 99人,外商独资．外企办事处,女装,33
宁波市海曙弟达服饰有限公司,浙江,浙江宁波,,,女装,33
苏州蔻依服饰有限公司,江苏,江苏苏州,50 - 99人,私营．民营企业,女装,33
恒金制衣有限公司,广东,广东东莞,500 - 999人,私营．民营企业,"男装,女装,童装",33
上海竞择针织时装有限公司,上海,上海,,,"女装,童装",33
中山领秀展示制品有限公司,广东,广东中山,,,其他,33
衣川文化（北京）有限公司,北京,北京,,,男装,33
佛山市富全美斯贸易有限公司,广东,广东佛山,,,"女装,童装,内衣",33
广东树业文化创意策划有限公司,广东,广东汕头,100 - 499人,私营．民营企业,"毛衫针织,女装,童装,男装",34
润春服饰,湖北,湖北武汉,,,,34
北京润田咨询服务有限公司,北京,北京,1 - 49人,私营．民营企业,"男装, 女装",34
苏州奥蒂莉亚婚纱礼服有限公司,江苏,江苏苏州,1 - 49人,私营．民营企业,"女装,婚纱礼服",34
~子测试,,,,,,34
郑州来又来商贸有限公司,河南,河南郑州,,,女装,34
杭州吉敏网络科技有限公司,浙江,浙江杭州,100 - 499人,私营．民营企业,"女装,其他,面辅料",34
贝尔品牌运营管理（广州）有限公司,广东,广东广州,100 - 499人,私营．民营企业,童装,34
比欧(深圳)贸易有限公司广州分公司,广东,广东广州,100 - 499人,私营．民营企业,女装,34
安踏中国,福建,福建厦门,,,"男装,女装,童装,鞋业,运动休闲",34
广州市塞飞洛皮具有限公司,广东,广东广州,100 - 499人,私营．民营企业,皮革,35
青岛嘟嘟比拉服饰有限公司,山东,山东青岛,,,童装,35
广东名鳄服饰实业有限公司,广东,广东广州,,,,35
广州市麦丽兴服装设计有限公司,广东,广东广州,,,婚纱礼服,35
合肥丽景服饰有限责任公司,安徽,安徽合肥,1 - 49人,外商独资．外企办事处,"女装,童装,运动休闲,丝绸",35
杭州兰本服饰有限公司,浙江,浙江杭州,,,女装,35
郑州战科贸易有限公司,河南,河南郑州,1 - 49人,私营．民营企业,"女装,鞋业,饰品,箱包,男装",35
广州云翥轩设计有限公司,广东,广东广州,1 - 49人,外商独资．外企办事处,"女装,皮革,羽绒服,面辅料,其他",35
苏州乐贝网络科技有限公司,江苏,江苏苏州,,,"婚纱礼服,女装",35
天漫文化创意（武汉）有限公司,湖北,湖北武汉,1 - 49人,私营．民营企业,其他,35
温州千领服饰有限公司,浙江,浙江温州,100 - 499人,私营．民营企业,"男装, 女装",36
温州保蒙国际贸易有限公司,浙江,浙江温州,1 - 49人,私营．民营企业,男装,36
广州昔古服饰有限公司,广东,广东广州,50 - 99人,私营．民营企业,"男装, 女装",36
丹东市唐人服饰有限公司,辽宁,辽宁丹东,,,"女装, 正装, 婚纱礼服, 职业装, 其他",36
浙江海明控股,浙江,浙江杭州,1000人以上,私营．民营企业,"男装, 女装, 童装",36
杭州里奈服饰有限公司,浙江,浙江杭州,50 - 99人,私营．民营企业,女装,36
E品设计机构,浙江,浙江湖州,,,童装,36
广州润韦祥进出口贸易有限公司,广东,广东广州,50 - 99人,私营．民营企业,女装,36
广州市祥派纺织品有限公司,广东,广东广州,50 - 99人,私营．民营企业,"男装, 女装",36
广州浮笪琦贸易有限公司,广东,广东广州,50 - 99人,私营．民营企业,女装,36
广州玺裳服饰设计有限公司,广东,广东广州,50 - 99人,私营．民营企业,女装,37
完美蜕变,江苏,江苏常州,,,,37
好纠结测试账号,西藏,西藏阿里,,,,37
周口美西制衣厂,河南,河南周口,,,"女装, 童装, 面辅料",37
深圳市初一设计工作室有限公司,广东,广东深圳,,,"女装,男装",37
深圳市慕尚天街文化发展有限公司,广东,广东深圳,,,"男装,职业装,正装,女装,童装",37
上海般诺服饰有限公司,上海,上海,1 - 49人,私营．民营企业,"童装,毛衫针织,其他",37
义乌市略凡商贸有限公司,浙江,浙江金华,100 - 499人,私营．民营企业,"袜业, 箱包",37
杭州优杰梵亦纺织科技有限公司,浙江,浙江杭州,50 - 99人,私营．民营企业,其他,37
上海函青服饰有限公司,上海,上海,,,,37
杭州华意文化创意公司,浙江,浙江杭州,,,女装,38
杭州窗外服饰有限公司,浙江,浙江杭州,,,,38
福州卡凡衣诺服饰有限公司,福建,福建福州,,,女装,38
广州建吉贸易有限公司,广东,广东广州,1 - 49人,其它,其他,38
浙江统领服饰有限公司,浙江,浙江温州,1 - 49人,私营．民营企业,"职业装,饰品,正装",38
深圳市中创投资有限公司,北京,北京,,,,38
重庆金锁针制衣有限公司,重庆,重庆,,,,38
武汉雅黛丽服饰有限公司,湖北,湖北武汉,,,内衣,38
杭州大方服饰有限公司,浙江,浙江杭州,100 - 499人,私营．民营企业,女装,38
青岛美欧达国际贸易有限公司,山东,山东青岛,,,"男装,童装,女装,运动休闲,羽绒服",38
安徽华阳服饰有限公司,安徽,安徽芜湖,1 - 49人,私营．民营企业,女装,39
长沙市天虹百货有限公司湘潭分公司,湖南,湖南湘潭,500 - 999人,中外合营(合资．合作),"其他,男装,女装,童装,家纺",39
良依库,湖南,湖南长沙,1 - 49人,私营．民营企业,"男装, 女装",39
株洲市佳依福中老年服饰有限公司,湖南,湖南株洲,,,女装,39
深圳市界道贸易有限公司,广东,广东深圳,100 - 499人,私营．民营企业,女装,39
深圳市鹰腾服饰有限公司,广东,广东深圳,,,"女装,男装,正装,职业装",39
广州乐途贸易有限公司,广东,广东广州,,,"女装,牛仔,毛衫针织,箱包,羽绒服",39
广州克洛纬思服装有限公司,广东,广东广州,,,童装,39
湖州织里美亮妞制衣厂,浙江,浙江湖州,,,童装,39
福州欧百尚体育用品有限公司,福建,福建福州,100 - 499人,外商独资．外企办事处,鞋业,39
上班,,,,政府机关／非盈利机构,"婚纱礼服,内衣,童装,职业装,运动休闲",40
北京波丝乐蒂服装有限公司广州办事处,广东,广东广州,50 - 99人,私营．民营企业,女装,40
广州派运服饰有限公司,广东,广东广州,,,男装,40
佛山市顺德区康加达服饰有限公司,广东,广东佛山,100 - 499人,私营．民营企业,"男装, 女装",40
浙江莹蔻时装有限公司,浙江,浙江绍兴,100 - 499人,私营．民营企业,女装,40
智联测试09,,,,,,40
智联测试08,,,,,,40
河南领尚文化传媒有限公司,河南,河南郑州,1 - 49人,外商独资．外企办事处,"童装,女装,男装,内衣,皮革",40
雅者定制,广东,广东深圳,1 - 49人,私营．民营企业,男装,40
丰年制衣（深圳）有限公司,广东,广东深圳,1 - 49人,外商独资．外企办事处,女装,40
东莞市火影数码印花有限公司,广东,广东东莞,,,"面辅料,女装,男装,泳装,其他",41
柒牌有限公司常熟分公司,江苏,江苏南京,1000人以上,私营．民营企业,男装,41
广州瑾悦蓝服装公司,广东,广东广州,100 - 499人,外商独资．外企办事处,"女装,牛仔,童装,毛衫针织,其他",41
木子韩服饰有限公司,,,,,,41
安徽省欧诺服饰有限公司,安徽,安徽合肥,1 - 49人,私营．民营企业,"女装,男装,童装",41
东莞市纽方服饰有限公司,广东,广东东莞,,,,41
佛山市南海区洪莉内衣厂,广东,广东佛山,100 - 499人,私营．民营企业,内衣,41
香港服装学院,广东,广东深圳,1 - 49人,外商独资．外企办事处,其他,41
广州采辰科技有限公司,广东,广东广州,,,"女装,正装,运动休闲,饰品",41
杭州亿三服饰有限公司,浙江,浙江杭州,,私营．民营企业,女装,41
兽霸鞋业有限公司,浙江,浙江丽水,,,"童装, 鞋业, 饰品, 箱包",42
广州绒织道羊绒制品股份有限公司,广东,广东广州,50 - 99人,私营．民营企业,"男装, 女装",42
杭州君玺实业有限公司,浙江,浙江杭州,,,"女装,男装,牛仔,毛衫针织",42
广州羽泰商业发展有限公司,广东,广东广州,50 - 99人,私营．民营企业,女装,42
纪念日,广东,广东广州,1000人以上,事业单位,女装,42
开平市秒发热服装有限公司,广东,广东江门,,,"羽绒服,家纺,其他",42
杭州贝嘟科技有限公司,广东,广东广州,,,,42
滕州市习之商贸有限公司,山东,山东枣庄,100 - 499人,私营．民营企业,女装,42
深圳市秦川服装设计有限公司,广东,广东深圳,,,童装,42
惠州市玛丝菲尔时装制造有限公司,广东,广东惠州,1000人以上,私营．民营企业,"女装,男装,皮革",42
杭州速盟户外用品有限公司,浙江,浙江杭州,100 - 499人,外商独资．外企办事处,"男装,女装,运动休闲",43
广州市番禺恒裕针织制衣有限公司,广东,广东广州,100 - 499人,中外合营(合资．合作),运动休闲,43
广州市锵锵服装有限公司,广东,广东广州,1 - 49人,外商独资．外企办事处,"男装,童装",43
英特,广东,广东深圳,,,运动休闲,43
安沃尔中国,北京,北京,,,,43
广州衣匠私定服饰有限公司,广东,广东广州,100 - 499人,私营．民营企业,"女装, 皮革",43
杭州杭丝时装进出口有限公司深圳分公司,广东,广东深圳,100 - 499人,私营．民营企业,女装,43
湖北宝雅服饰有限公司,湖北,湖北鄂州,100 - 499人,私营．民营企业,女装,43
广州O蕾服装设计有限公司,广东,广东广州,1 - 49人,私营．民营企业,女装,43
深圳市鑫城时装有限公司,广东,广东深圳,100 - 499人,外商独资．外企办事处,"男装,女装,童装,正装,羽绒服",43
杭州丽妮服饰有限公司,浙江,浙江杭州,,,女装,44
广州市永嘉制衣有限公司,广东,广东广州,,,"男装,女装,牛仔",44
杭州韦芙网络科技有限公司,浙江,浙江杭州,1 - 49人,私营．民营企业,女装,44
深圳市芳芳鞋业有限公司,广东,广东深圳,,,,44
墨影文化传播有限公司,福建,福建厦门,,,女装,44
佛山市宾禾服饰有限公司,广东,广东佛山,50 - 99人,外商独资．外企办事处,男装,44
广州锁春内衣有限公司,广东,广东广州,,,内衣,44
明萱婴幼儿服饰,湖北,湖北荆州,1 - 49人,私营．民营企业,童装,44
中德服饰（广州）有限公司,广东,广东广州,1 - 49人,私营．民营企业,男装,44
永州欧丽雅服装有限公司,湖南,湖南长沙,,,"男装,女装,羽绒服,牛仔,职业装",44
蓝影（上海）服装有限公司,江苏,江苏常熟,,,,45
上海万黎实业有限公司,上海,上海,,,"男装,女装",45
浙江庞大贸易有限公司,浙江,浙江宁波,50 - 99人,私营．民营企业,女装,45
肇庆市显荣制衣厂有限公司,广东,广东肇庆,100 - 499人,外商独资．外企办事处,"童装,内衣,男装,女装,运动休闲",45
宁波唯N品牌管理有限公司,浙江,浙江宁波,,,童装,45
杭州赛莱服装工作室,浙江,浙江杭州,,,女装,45
广州芬瑶服饰有限公司,广东,广东广州,,,内衣,45
苏州戈朵婚纱礼服有限公司,江苏,江苏苏州,,,,45
泉州维真服饰实业有限公司,福建,福建泉州,1 - 49人,私营．民营企业,"童装,内衣,女装,男装",45
杭州紫音服饰有限公司,浙江,浙江杭州,100 - 499人,外商独资．外企办事处,童装,45
盈思网络科技（深圳）有限公司,浙江,浙江杭州,,,"男装,女装,运动休闲,箱包,饰品",46
东莞市金隆S纺织有限公司,广东,广东东莞,50 - 99人,港台澳企业,其他,46
知衣科技,浙江,浙江杭州,,,"女装,其他",46
苏苏卡农服饰有限公司,浙江,浙江湖州,,,童装,46
北京亿都川服装集团有限公司,北京,北京,100 - 499人,外商独资．外企办事处,"职业装,男装",46
淮安亿美达服装定制有限公司,江苏,江苏淮安,,,"男装,女装,童装,运动休闲,牛仔",46
望江翱澳贸易有限公司,上海,上海,100 - 499人,私营．民营企业,毛衫针织,46
迪亚隆服饰,安徽,安徽安庆,,,"男装, 女装",46
武汉唐城服装商贸有限公司,湖北,湖北武汉,1 - 49人,私营．民营企业,"男装,女装,正装,职业装",46
南京悦智兴工艺品有限公司,江苏,江苏南京,50 - 99人,私营．民营企业,"男装, 女装",46
南京莉莉丝绸贸易有限公司,江苏,江苏南京,50 - 99人,私营．民营企业,"男装, 女装",47
北京三金凯丽服装有限公司,北京,北京朝阳,,,童装,47
深圳市时尚聚点文化传媒有限公司,广东,广东广州,50 - 99人,私营．民营企业,"男装, 女装",47
广州富米科技有限公司,广东,广东广州,,,,47
佛山市摩根尚品服饰有限公司,广东,广东佛山,50 - 99人,私营．民营企业,男装,47
杭州美弘贸易有限公司,浙江,浙江杭州,,,男装,47
深圳市彩奇诗智能服饰有限公司,广东,广东深圳,1 - 49人,外商独资．外企办事处,"男装, 女装, 内衣",47
xiao hao,广东,广东深圳,1 - 49人,私营．民营企业,"男装, 女装",47
杭州立丰华品牌管理有限公司,浙江,浙江杭州,100 - 499人,私营．民营企业,女装,47
苏州锦祥纺织染整有限公司,江苏,江苏苏州,,,"面辅料,其他,毛衫针织,家纺",47
艺龙达深圳(贸易)有限公司,广东,广东深圳,,,女装,48
广州创艺美服装设计发展有限公司,广东,广东广州,1 - 49人,私营．民营企业,"男装, 女装, 皮革",48
广州市渡诺服装有限公司,广东,广东广州,1 - 49人,中外合营(合资．合作),女装,48
珠海珠澳跨境工业区加豪纺织有限公司,广东,广东珠海,100 - 499人,外商独资．外企办事处,"男装,童装,女装",48
广州鼎力创投服饰有限公司,广东,广东广州,,,男装,48
广州霍金时尚商业有限公司,广东,广东广州,1 - 49人,私营．民营企业,"男装, 正装, 职业装",48
~子测试,,,,,,48
广州卡萨图时尚服饰有限公司,广东,广东广州,,,,48
杭州草尚电子商务有限公司,浙江,浙江杭州,,,"男装,童装,女装",48
广州市依色锦服饰有限公司,广东,广东广州,50 - 99人,私营．民营企业,"饰品, 面辅料",48
南昌市如虎实业有限公司,江西,江西南昌,,,运动休闲,49
宁波可俐时装有限公司,浙江,浙江宁波,,,,49
成都威麟贸易有限公司,四川,四川成都,,,,49
爱徒（上海）国际贸易有限公司,上海,上海,100 - 499人,外商独资．外企办事处,,49
广州宝强儿童服饰有限公司,广东,广东广州,,,,49
佰龙实业,江西,江西赣州,,,"内衣,男装",49
优炫（上海）商贸有限公司,上海,上海,1 - 49人,外商独资．外企办事处,"男装,女装,皮革,毛衫针织,童装",49
陌上（厦门）品牌管理有限公司,福建,福建厦门,100 - 499人,私营．民营企业,女装,49
湘渝服饰,重庆,重庆,,,,49
杭州颖泰服装有限公司,浙江,浙江杭州,,,"男装,女装,童装,羽绒服,牛仔",49
杭州速销网络科技有限公司,浙江,浙江杭州,,,女装,50
杭州留白服装有限公司,浙江,浙江杭州,1 - 49人,私营．民营企业,"男装, 女装",50
海南服装工艺美术学校,海南,海南海口,50 - 99人,学院/培训机构,其他,50
重庆冬之晴服饰有限公司,重庆,重庆沙坪坝,,,"男装, 女装, 童装, 毛衫针织",50
宁波泛泛服饰有限公司,浙江,浙江宁波,100 - 499人,私营．民营企业,女装,50
杭州坤亚服饰有限公司,浙江,浙江杭州,1 - 49人,私营．民营企业,童装,50
浙江秀黛服饰,浙江,浙江杭州,100 - 499人,私营．民营企业,内衣,50
广东俏丹娜科技发展有限公司,广东,广东广州,100 - 499人,私营．民营企业,内衣,50
佛山市歌慕尔服饰有限公司,广东,广东佛山,100 - 499人,私营．民营企业,内衣,50
重庆哥亚诺服饰有限公司,重庆,重庆江北,,,职业装,50
飞虎婴幼儿服饰,湖北,湖北荆州,,,,51
广州市亦修服饰有限责任公司,广东,广东广州,,,女装,51
森溢服饰,北京,北京,,,,51
广州塔衫岛贸易有限公司,广东,广东广州,50 - 99人,私营．民营企业,"男装, 女装",51
义乌市小金鱼服装厂,浙江,浙江义乌,,,"童装,泳装",51
东莞鸿瑞有限公司,广东,广东东莞,,,女装,51
重庆霍顿菲德商贸有限公司,重庆,重庆,50 - 99人,私营．民营企业,女装,51
广州卡曼丹琪服装服饰有限公司,广东,广东广州,50 - 99人,私营．民营企业,,51
小祝服装设计工作室,浙江,浙江嘉兴,,,女装,51
湖州五星服饰,浙江,浙江湖州,,,,51
广州注释服饰有限公司,广东,广东广州,50 - 99人,私营．民营企业,女装,52
广州品立服装有限公司,广东,广东广州,,,"男装, 女装, 鞋业",52
深圳市佩雅时装有限公司,广东,广东深圳,,,"女装,男装,正装,职业装,其他",52
上海允裳服饰有限公司,上海,上海,1 - 49人,外商独资．外企办事处,女装,52
深圳市喜尚服饰有限公司,广东,广东深圳,1 - 49人,外商独资．外企办事处,女装,52
服可利（深圳）服饰有限公司,广东,广东深圳,100 - 499人,私营．民营企业,女装,52
深圳海青蓝服饰有限公司,广东,广东深圳,1 - 49人,私营．民营企业,女装,52
北京宇宙沙盘太空科技有限公司,北京,北京,,,"家纺,男装,运动休闲,内衣",52
深圳市云创服装设计有限公司,广东,广东深圳,,,女装,52
杭州玄艺服饰有限公司,浙江,浙江杭州,500 - 999人,私营．民营企业,女装,52
广州婵轩服装有限公司,广东,广东广州,100 - 499人,私营．民营企业,女装,53
东莞市梦想家服饰有限公司,广东,广东东莞,1 - 49人,外商独资．外企办事处,女装,53
浙江创发拉链科技有限公司,浙江,浙江杭州,100 - 499人,私营．民营企业,"面辅料,其他",53
广州言午商贸,广东,广东广州,100 - 499人,私营．民营企业,"男装, 女装",53
深圳市顶宜服饰有限公司,广东,广东深圳,,,,53
广州言墨写意服饰有限公司,广东,广东广州,50 - 99人,私营．民营企业,女装,53
深圳网禾科技有限公司,广东,广东深圳,1 - 49人,外商独资．外企办事处,"箱包,其他",53
连云港库恩服饰有限公司,江苏,江苏连云港,,,女装,53
雅维思集团,广东,广东广州,50 - 99人,私营．民营企业,"男装, 女装, 泳装",53
广州市稀雾壹迷服装有限公司,广东,广东广州,50 - 99人,私营．民营企业,女装,53
广州衣蕾贸易有限公司,广东,广东广州,50 - 99人,私营．民营企业,"女装,童装",54
苏州亚莱利服装有限公司,江苏,江苏苏州,50 - 99人,私营．民营企业,"男装, 女装",54
东莞市达可利服饰有限公司,广东,广东东莞,,,"男装,箱包",54
中山市歌绘服装有限公司,广东,广东中山,,,"内衣,泳装,饰品,袜业",54
广州又米服饰有限公司,广东,广东广州,100 - 499人,私营．民营企业,"女装,童装",54
广州蜜丝服装有限公司,广东,广东广州,1 - 49人,,女装,54
北京绅霸服装服饰有限责任公司,北京,北京,1 - 49人,私营．民营企业,"男装,女装,正装",54
青岛盛雅祺服装公司,山东,山东青岛,,,,54
成都市雷鸣服饰有限公司,四川,四川成都,,,女装,54
中山市大涌久和制衣厂,广东,广东中山,100 - 499人,私营．民营企业,牛仔,54
安百玉服饰,广东,广东东莞,1 - 49人,私营．民营企业,女装,55
杭州丝如玉文化艺术有限公司,浙江,浙江杭州,1 - 49人,私营．民营企业,"女装, 丝绸",55
杭州池创服饰有限公司,浙江,浙江杭州,,,,55
广州市堡狮龙实业有限公司,广东,广东广州,,,"男装,女装,童装",55
广州市展伟服饰有限公司,广东,广东珠海,50 - 99人,私营．民营企业,女装,55
无锡天源针织有限公司,江苏,江苏无锡,50 - 99人,私营．民营企业,毛衫针织,55
匹克湛江分公司,广东,广东湛江,,,,55
南京港威服装有限公司,江苏,江苏南京,1 - 49人,外商独资．外企办事处,"童装,女装,牛仔,毛衫针织",55
广州东胤纺织有限公司,广东,广东广州,50 - 99人,私营．民营企业,女装,55
广州市新贺源服装有限公司,广东,广东广州,,,,55
广州欧玛力服饰有限公司,广东,广东广州,1 - 49人,私营．民营企业,女装,56
中山非常姊妹服饰有限公司,广东,广东中山,,,内衣,56
无锡恒隆纺织品有限公司,江苏,江苏无锡,100 - 499人,私营．民营企业,面辅料,56
广州茵姿服饰有限公司,广东,广东广州,100 - 499人,私营．民营企业,女装,56
广州路易诗兰服饰股份有限公司,广东,广东广州,100 - 499人,私营．民营企业,职业装,56
东弘服饰常州办事处,江苏,江苏常州,1 - 49人,外商独资．外企办事处,"男装, 女装, 面辅料, 其他",56
杭州猫酱紫服饰有限公司,浙江,浙江杭州,,,女装,56
杭州泽远服饰,浙江,浙江杭州,,,童装,56
武汉市优拉拉服饰有限公司,湖北,湖北武汉,,,童装,56
海南舒尔逸服饰有限公司,海南,海南海口,100 - 499人,私营．民营企业,"运动休闲,男装,女装,职业装,童装",56
武汉华美达服饰有限公司,湖北,湖北武汉,,,,57
嘉兴云慧嘉时装有限公司,浙江,浙江嘉兴,,,"男装,女装,童装,运动休闲,正装",57
广州润发服装有限责任公司,广东,广东广州,100 - 499人,私营．民营企业,女装,57
深圳市大乐母婴电子商务有限公司,广东,广东深圳,1 - 49人,私营．民营企业,女装,57
深圳市诺欣宏远商贸有限公司,广东,广东深圳,50 - 99人,外商独资．外企办事处,"男装, 女装, 内衣, 童装, 泳装",57
金秋菀服饰贸易,浙江,浙江杭州,50 - 99人,私营．民营企业,,57
杭州一迹墨一时装有限公司,浙江,浙江金华,50 - 99人,私营．民营企业,"男装, 女装",57
广州市帝芙仕服饰有限公司,广东,广东广州,50 - 99人,私营．民营企业,运动休闲,57
深圳天赢投资发展集团有限公司,广东,广东深圳,,,"皮革,箱包,女装,饰品,家纺",57
悦己SELF,北京,北京,,,"男装, 女装, 牛仔, 饰品, 职业装",57
台州市黄岩圣美莱制帽厂,浙江,浙江台州,,,,58
宁波棉朵电子商务有限公司,浙江,浙江宁波,,,家纺,58
深圳市艾妮路服饰有限公司,广东,广东深圳,1 - 49人,外商独资．外企办事处,女装,58
东莞东林制衣有限公司,广东,广东东莞,1000人以上,私营．民营企业,"男装,童装,女装,毛衫针织,运动休闲",58
北京梦芝雪服装服饰有限公司,北京,北京,50 - 99人,私营．民营企业,"女装, 羽绒服",58
浙江浦江依兰特服饰有限公司,浙江,浙江金华,,,"女装, 内衣, 童装, 运动休闲, 毛衫针织",58
上海百赫服饰有限公司,上海,上海,,,女装,58
河南元亨利贞服饰由公司,河南,河南郑州,,,女装,58
深圳市威尔金森服饰有限公司,广东,广东深圳,1 - 49人,私营．民营企业,"女装,男装,职业装,正装,其他",58
深圳市肯林时装有限公司,广东,广东中山,,,"女装, 鞋业, 牛仔, 毛衫针织, 丝绸",58
广州市米茵服饰有限公司,广东,广东广州,,,"内衣,女装",59
杭州差池服饰有限公司,浙江,浙江杭州,1 - 49人,私营．民营企业,男装,59
北京万泽兴业商贸有限公司,北京,北京,1 - 49人,私营．民营企业,女装,59
湖北东林服装有限公司,湖北,湖北荆门,1000人以上,私营．民营企业,"运动休闲,毛衫针织",59
汕头市佳晨服装实业有限公司,广东,广东汕头,100 - 499人,私营．民营企业,"女装, 内衣, 其他",59
广州朗风服装设计有限公司,广东,广东广州,,,"男装,女装,羽绒服",59
汕头市多拉美制衣实业有限公司,广东,广东汕头,,,"男装,女装",59
广州细刻网络科技有限公司,广东,广东广州,100 - 499人,,"男装, 女装, 鞋业, 箱包",59
宁波英锐维格贸易有限公司,浙江,浙江宁波,1 - 49人,私营．民营企业,女装,59
广州市美昭珍服饰有限公司,广东,广东广州,50 - 99人,私营．民营企业,女装,59
