company_name,province,location,size,nature,business,page_num
广州市海珠区紫依缘服装设计工作室,广东,广东广州,100 - 499人,私营．民营企业,女装,290
广东泰格实业投资有限公司(金利来时尚休闲）,广东,广东广州,1 - 49人,外商独资．外企办事处,男装,290
苏州正雄企业发展有限公司,江苏,江苏苏州,1000人以上,港台澳企业,"男装,女装,面辅料,丝绸",290
华纳斯服装有限公司,浙江,浙江嘉兴,,,"女装, 皮革",290
广州和锦进出口有限公司,广东,广东广州,50 - 99人,私营．民营企业,女装,290
瑞安市印象海服饰有限公司,浙江,浙江温州,50 - 99人,外商独资．外企办事处,男装,290
浙江耐特利尔皮革时装有限公司,浙江,浙江嘉兴,100 - 499人,私营．民营企业,"男装,女装,皮革",290
传承（泉州）服饰有限公司,福建,福建泉州,100 - 499人,私营．民营企业,"男装, 皮革, 运动休闲",290
嘉兴沃森服饰有限公司,浙江,浙江嘉兴,50 - 99人,私营．民营企业,"女装, 毛衫针织",291
广州富纳服装有限公司,广东,广东广州,50 - 99人,私营．民营企业,"内衣, 毛衫针织",291
宜昌赛福纺织品有限公司,江苏,江苏无锡,100 - 499人,私营．民营企业,"男装,女装,童装,羽绒服,家纺",291
义乌市媚火内衣厂,浙江,浙江金华,1 - 49人,私营．民营企业,内衣,291
苏州华纱服饰有限公司,江苏,江苏苏州,50 - 99人,私营．民营企业,"婚纱礼服, 其他",291
温州市欧吉佳服饰有限公司,浙江,浙江温州,1 - 49人,私营．民营企业,男装,291
宁波艾克服饰有限公司,浙江,浙江宁波,50 - 99人,私营．民营企业,"毛衫针织, 其他",291
广州铂仕服装有限公司(铂顿),广东,广东广州,,,"男装, 女装, 童装, 正装, 职业装",291
江苏舜天股份有限公司,江苏,江苏南京,,,"男装, 女装",291
深圳市莎斐妮服饰有限公司,广东,广东深圳,,,内衣,291
广州一尚门服装有限公司,广东,广东广州,50 - 99人,外商独资．外企办事处,"男装, 女装, 饰品, 箱包, 其他",292
温州市丑鸭工贸有限公司,浙江,浙江温州,,,"男装, 女装",292
广州市易尔涵服饰有限公司,广东,广东广州,100 - 499人,私营．民营企业,女装,292
荆州市红飞针织服饰有限公司,湖北,湖北荆州,500 - 999人,私营．民营企业,童装,292
浙江凤凰庄纺织品有限公司,浙江,浙江杭州,500 - 999人,私营．民营企业,"男装, 女装",292
广州骆驼世家鞋业有限公司,广东,广东广州,500 - 999人,私营．民营企业,"男装, 内衣, 童装, 鞋业, 运动休闲",292
佛山市西本服饰有限公司,广东,广东佛山,100 - 499人,私营．民营企业,男装,292
深圳市古根服饰有限公司（东方龙）,广东,广东深圳,100 - 499人,私营．民营企业,职业装,292
东莞市西橙子服饰有限公司,广东,广东东莞,100 - 499人,港台澳企业,,292
东莞市动感服饰有限公司,广东,广东东莞,100 - 499人,私营．民营企业,内衣,292
宁波商卡立服装科技有限公司,浙江,浙江宁波,100 - 499人,私营．民营企业,"女装, 毛衫针织",293
重庆自力针织制衣有限公司,重庆,重庆,,,毛衫针织,293
广州红宝服饰有限公司,广东,广东广州,1 - 49人,私营．民营企业,婚纱礼服,293
上海霞芬时装有限公司北京分公司,北京,北京,1 - 49人,私营．民营企业,"男装,女装",293
东莞市路西米儿制衣有限公司,广东,广东东莞,1 - 49人,外商独资．外企办事处,童装,293
深圳优普泰服装科技有限公司,广东,广东深圳,100 - 499人,私营．民营企业,"正装,面辅料,其他",293
上海梵诺羊绒服饰有限公司,上海,上海,1 - 49人,外商独资．外企办事处,"男装, 女装, 毛衫针织",293
中山市巴拉贸易有限公司,广东,广东中山,1 - 49人,外商独资．外企办事处,童装,293
温州鸿都服饰有限公司,浙江,浙江温州,100 - 499人,私营．民营企业,男装,293
三针服饰（杭州）有限公司,浙江,浙江杭州,100 - 499人,私营．民营企业,"内衣, 毛衫针织",293
广州依趣服装有限公司武汉分公司,湖北,湖北武汉,50 - 99人,私营．民营企业,女装,294
深圳市米珂拉服饰有限公司,广东,广东深圳,100 - 499人,私营．民营企业,女装,294
深圳市聚龙成服饰有限公司,广东,广东深圳,1 - 49人,外商独资．外企办事处,女装,294
北京丛氏服装服饰有限公司,北京,北京,100 - 499人,私营．民营企业,"正装, 职业装",294
优盟制衣有限公司,广东,广东东莞,,,,294
南京恒优满服饰有限公司,江苏,江苏南京,50 - 99人,私营．民营企业,"男装, 女装",294
广州市乔盾保罗服饰有限公司,广东,广东广州,100 - 499人,私营．民营企业,男装,294
深圳市图雅服饰有限公司,广东,广东深圳,100 - 499人,私营．民营企业,"男装, 女装, 婚纱礼服, 职业装",294
佛山市艾蓓怡服饰有限公司,广东,广东佛山,100 - 499人,私营．民营企业,女装,294
张家港市昊澜纺织有限公司,江苏,江苏苏州,1 - 49人,私营．民营企业,"内衣,毛衫针织",294
深圳诗曼芬实业有限公司,广东,广东深圳,100 - 499人,国内上市公司,内衣,295
浙江万羽针织有限公司,浙江,浙江金华,1 - 49人,外商独资．外企办事处,内衣,295
张家港泽丰纺织品有限公司,江苏,江苏苏州,50 - 99人,外商独资．外企办事处,"男装, 女装, 内衣, 童装, 毛衫针织",295
深圳市静甫服装设计有限公司,广东,广东深圳,100 - 499人,外商独资．外企办事处,"男装, 女装, 童装, 鞋业, 运动休闲",295
无锡诗翠时装有限公司,江苏,江苏无锡,50 - 99人,外商独资．外企办事处,"男装, 女装",295
圣迪保顿（中国）有限公司,广东,广东广州,50 - 99人,私营．民营企业,男装,295
蒙诺奇佳童装,浙江,浙江台州,1 - 49人,私营．民营企业,童装,295
宁波安雅若品牌管理有限公司,浙江,浙江宁波,100 - 499人,私营．民营企业,女装,295
中山鸿福婴童用品有限公司,广东,广东中山,50 - 99人,私营．民营企业,童装,295
北京恒千翔国际贸易有限公司,北京,北京,50 - 99人,私营．民营企业,"男装, 运动休闲, 面辅料, 羽绒服",295
哈森商贸(中国)股份有限公司,上海,上海,500 - 999人,国内上市公司,鞋业,296
广州格度服饰有限公司,广东,广东广州,100 - 499人,私营．民营企业,"男装,正装,职业装",296
深圳森怡嘉时装有限公司,广东,广东深圳,100 - 499人,私营．民营企业,女装,296
北京东方绮丽服装服饰有限责任公司,北京,北京,100 - 499人,私营．民营企业,女装,296
杭州伯乐针织制衣有限公司,浙江,浙江杭州,100 - 499人,私营．民营企业,"女装, 毛衫针织",296
桐乡市吉洋时装有限公司,浙江,浙江嘉兴,100 - 499人,中外合营(合资．合作),,296
浙江创之捷服装设计有限公司,浙江,浙江嘉兴,100 - 499人,外商独资．外企办事处,"男装,女装,童装,皮革,正装",296
杭州乐驼服饰有限公司,浙江,浙江杭州,500 - 999人,外商独资．外企办事处,"男装, 女装, 童装, 运动休闲, 羽绒服",296
广州丽人诗歌内衣有限公司,广东,广东广州,50 - 99人,私营．民营企业,内衣,296
杭州中微迪际服饰有限公司,浙江,浙江杭州,500 - 999人,私营．民营企业,"男装, 女装",296
杭州萌婉服饰有限公司（品牌香影）,浙江,浙江杭州,1000人以上,私营．民营企业,女装,297
东莞市美皇制衣有限公司,广东,广东广州,1 - 49人,私营．民营企业,女装,297
东莞市睿锋服饰贸易有限公司,广东,广东东莞,50 - 99人,港台澳企业,女装,297
杭州昊悦服饰,浙江,浙江杭州,50 - 99人,中外合营(合资．合作),其他,297
武汉天鸣集团有限公司,湖北,湖北武汉,1000人以上,私营．民营企业,"鞋业, 职业装",297
扬州名模时装有限公司,江苏,江苏扬州,,,,297
广州凯盛服装有限公司,广东,广东广州,100 - 499人,港台澳企业,女装,297
浙江东企企业,浙江,浙江嘉兴,100 - 499人,私营．民营企业,毛衫针织,297
湖州华诺青少年品牌童装,浙江,浙江湖州,100 - 499人,私营．民营企业,童装,297
南京优思艾国际贸易有限公司,江苏,江苏南京,100 - 499人,私营．民营企业,"男装, 运动休闲, 牛仔",297
杭州市临安欧尚纺织有限公司,浙江,浙江杭州,100 - 499人,私营．民营企业,饰品,298
深圳缘尚儿时装有限公司,广东,广东深圳,50 - 99人,私营．民营企业,女装,298
德曼妮时装（深圳）有限公司,广东,广东深圳,100 - 499人,外商独资．外企办事处,女装,298
广州阿米古鞋业有限公司,广东,广东广州,1 - 49人,外商独资．外企办事处,"男装, 女装, 童装, 牛仔, 箱包",298
南通绅宝利工艺服饰有限公司,江苏,江苏南通,500 - 999人,外商独资．外企办事处,"男装, 女装, 童装",298
佛山市南海枫莲内衣有限公司,广东,广东佛山,1000人以上,私营．民营企业,内衣,298
宁波经济技术开发区华晶制衣有限公司,浙江,浙江宁波,100 - 499人,私营．民营企业,"男装, 女装, 童装, 牛仔, 毛衫针织",298
扬州汉梦服饰制造有限公司,江苏,江苏扬州,100 - 499人,外商独资．外企办事处,其他,298
郑州心语泉服饰有限公司,河南,河南郑州,50 - 99人,私营．民营企业,女装,298
广州天启服饰有限公司,广东,广东广州,1 - 49人,私营．民营企业,"女装, 童装",298
东阳市江北龙雨服饰厂,浙江,浙江金华,50 - 99人,私营．民营企业,童装,299
广州尚南贸易有限公司,广东,广东广州,50 - 99人,私营．民营企业,"男装, 正装, 职业装, 毛衫针织, 面辅料",299
广州融尚服装有限公司,广东,广东广州,1 - 49人,私营．民营企业,女装,299
深圳天幕服装有限公司,广东,广东深圳,500 - 999人,私营．民营企业,"男装, 女装, 童装",299
上海哈商贸有限公司,上海,上海,100 - 499人,外商独资．外企办事处,女装,299
广州君衡合壹服装有限公司,广东,广东广州,50 - 99人,私营．民营企业,女装,299
温州美青服饰有限公司,浙江,浙江杭州,50 - 99人,私营．民营企业,童装,299
远东服装（苏州）有限公司,江苏,江苏苏州,100 - 499人,中外合营(合资．合作),运动休闲,299
湖州石氏服饰有限公司,浙江,浙江湖州,1 - 49人,私营．民营企业,童装,299
广州市燕翔服装有限公司,广东,广东广州,1 - 49人,私营．民营企业,女装,299
广州欧蒂时装有限公司,广东,广东广州,50 - 99人,私营．民营企业,女装,300
深圳市迪迪贝贝服饰有限公司(巴柯拉),广东,广东深圳,500 - 999人,私营．民营企业,童装,300
台州名利家居用品有限公司,浙江,浙江台州,50 - 99人,私营．民营企业,"饰品, 家纺, 其他",300
湖州织里盼盼熊制衣厂,浙江,浙江湖州,100 - 499人,私营．民营企业,童装,300
广东皮尔卡丹品牌管理有限公司,广东,广东广州,100 - 499人,私营．民营企业,"皮革, 鞋业",300
保兰德集团（中国）有限公司,广东,广东广州,500 - 999人,外商独资．外企办事处,箱包,300
香港森磊服饰有限公司,广东,广东广州,1 - 49人,私营．民营企业,牛仔,300
浙江裕德服装有限公司,浙江,浙江嘉兴,500 - 999人,私营．民营企业,女装,300
东莞天河针织有限公司,广东,广东东莞,1000人以上,外商独资．外企办事处,毛衫针织,300
昆山纳尼网络科技有限公司,江苏,江苏苏州,50 - 99人,私营．民营企业,童装,300
杭州简正电子商务有限公司,浙江,浙江杭州,100 - 499人,私营．民营企业,男装,301
江苏鹿港朗帕服饰有限公司,江苏,江苏苏州,1000人以上,国内上市公司,"男装, 女装, 职业装",301
广州Z悦贸易有限公司  千彦,广东,广东广州,1 - 49人,私营．民营企业,男装,301
广州钜丰服装有限公司,广东,广东深圳,1 - 49人,私营．民营企业,女装,301
广州珈姿莱尔服饰有限公司,广东,广东广州,1 - 49人,私营．民营企业,女装,301
杭州男帝服饰,浙江,浙江杭州,100 - 499人,私营．民营企业,男装,301
上海捷隆贸易有限公司,上海,上海,500 - 999人,港台澳企业,其他,301
天津市金凤銮旗袍高级定制工作室,天津,天津,1 - 49人,私营．民营企业,"女装,婚纱礼服,丝绸",301
杭州圣百俪服饰有限公司,浙江,浙江杭州,100 - 499人,外商独资．外企办事处,女装,301
杭州利沃贸易有限公司,浙江,浙江杭州,50 - 99人,私营．民营企业,男装,301
成都金牛区杰云服装商贸部,四川,四川成都,100 - 499人,私营．民营企业,"男装,女装,运动休闲,牛仔",302
深圳市五百色艺术设计有限公司,广东,广东深圳,1 - 49人,私营．民营企业,女装,302
广州市捷臣服装有限公司,广东,广东深圳,100 - 499人,港台澳企业,女装,302
广州特力普思埃商业有限公司,广东,广东广州,1 - 49人,私营．民营企业,女装,302
宁波声宏进出口有限公司,浙江,浙江宁波,500 - 999人,港台澳企业,"男装, 女装, 童装",302
广州赢者乐士服饰有限公司,广东,广东广州,100 - 499人,外商独资．外企办事处,男装,302
钡萱服装（深圳）有限公司,广东,广东深圳,100 - 499人,外商独资．外企办事处,女装,302
广州市登极旅行用品有限公司（极地）,广东,广东广州,50 - 99人,私营．民营企业,运动休闲,302
杭州亿丰纺织品有限公司,浙江,浙江绍兴,100 - 499人,私营．民营企业,童装,302
深圳市凡亿格商贸有限公司,广东,广东深圳,1 - 49人,私营．民营企业,"男装,女装,童装",302
杭州冉秋服饰有限公司,浙江,浙江杭州,100 - 499人,私营．民营企业,女装,303
广州市例外服饰有限公司,广东,广东广州,100 - 499人,外商独资．外企办事处,女装,303
广州绅田杉森服饰有限公司(迪蒙世),广东,广东广州,50 - 99人,私营．民营企业,男装,303
苏州莫瑞服装有限公司,江苏,江苏苏州,50 - 99人,私营．民营企业,男装,303
广州祖琦服饰有限公司,广东,广东广州,50 - 99人,私营．民营企业,"童装,鞋业",303
杭州红艮时装有限公司,浙江,浙江杭州,100 - 499人,港台澳企业,女装,303
宁波卡米利亚服饰有限公司,浙江,浙江宁波,100 - 499人,外商独资．外企办事处,"男装,女装,童装",303
深圳凤舞服饰有限公司,广东,广东广州,50 - 99人,私营．民营企业,内衣,303
深圳市华沁时装设计有限公司,广东,广东深圳,100 - 499人,私营．民营企业,女装,303
广州雷雕服饰有限公司,广东,广东广州,1 - 49人,外商独资．外企办事处,运动休闲,303
上海梨辞服饰有限公司,上海,上海,100 - 499人,中外合营(合资．合作),"男装,女装",304
江苏木杉服饰有限公司,江苏,江苏苏州,500 - 999人,私营．民营企业,女装,304
广州臻曼服饰有限公司,广东,广东广州,1 - 49人,私营．民营企业,女装,304
东莞福珍针织制衣有限公司,广东,广东东莞,1000人以上,港台澳企业,毛衫针织,304
苏州史威特服饰有限公司,江苏,江苏苏州,1000人以上,港台澳企业,毛衫针织,304
南京同德服装有限公司,江苏,江苏南京,50 - 99人,私营．民营企业,"男装, 女装, 童装, 皮革, 羽绒服",304
济南瑞品服饰有限责任公司,山东,山东济南,50 - 99人,私营．民营企业,"男装, 女装, 童装",304
深圳优衣购服饰有限责任公司,广东,广东深圳,1 - 49人,私营．民营企业,女装,304
湖州织里越谷服饰公司,浙江,浙江湖州,100 - 499人,私营．民营企业,"男装, 女装",304
杭州丝雨桐服饰,浙江,浙江杭州,50 - 99人,私营．民营企业,"男装, 女装",304
南京咏瑶服饰有限公司,江苏,江苏苏州,100 - 499人,私营．民营企业,"男装, 女装",305
海盐三马发展有限公司,浙江,浙江嘉兴,1000人以上,私营．民营企业,男装,305
东莞狄安服饰有限公司,广东,广东东莞,100 - 499人,港台澳企业,男装,305
广州格弟服饰有限公司“鑫美”女装,广东,广东广州,100 - 499人,私营．民营企业,女装,305
重庆波拉米拉服装有限公司,重庆,重庆,500 - 999人,私营．民营企业,女装,305
广州君英贸易有限公司,广东,广东广州,50 - 99人,私营．民营企业,女装,305
上海中昊针织有限公司,上海,上海,1 - 49人,私营．民营企业,内衣,305
上海鸿翔百货有限公司,上海,上海,50 - 99人,国有企业,女装,305
永升天使制衣厂,浙江,浙江湖州,100 - 499人,私营．民营企业,"童装, 毛衫针织",305
艾安琪国际服装有限公司,广东,广东东莞,100 - 499人,港台澳企业,女装,305
百德（广泰）针织有限公司,广东,广东东莞,50 - 99人,港台澳企业,毛衫针织,306
北京天玛时服装服饰有限公司,北京,北京,50 - 99人,私营．民营企业,"男装, 女装",306
深圳市粤顺鑫服装有限公司,广东,广东深圳,100 - 499人,私营．民营企业,"男装,女装,职业装,羽绒服",306
郑州怡初服饰有限公司,河南,河南新乡,100 - 499人,外商独资．外企办事处,女装,306
欧宝远东服饰(深圳)有限公司,广东,广东深圳,500 - 999人,私营．民营企业,"男装, 女装, 鞋业, 箱包, 羽绒服",306
宁波仁鑫杰纳思服装有限公司,浙江,浙江宁波,50 - 99人,私营．民营企业,男装,306
杭州朗闻时装有限公司,浙江,浙江杭州,50 - 99人,私营．民营企业,,306
江苏百瑞贸易有限公司,江苏,江苏苏州,500 - 999人,私营．民营企业,运动休闲,306
广州阔色服装有限公司,广东,广东广州,50 - 99人,私营．民营企业,女装,306
陕西羊老大服饰股份有限公司,陕西,陕西榆林,100 - 499人,私营．民营企业,"男装, 女装, 正装, 羽绒服",306
深圳市致达服饰（温纯品牌）有限公司,广东,广东深圳,500 - 999人,私营．民营企业,"男装,女装",307
广州执物服饰有限公司,广东,广东广州,50 - 99人,私营．民营企业,"男装, 女装",307
广州市蒂伦奴那服饰有限公司,广东,广东广州,50 - 99人,私营．民营企业,女装,307
广州元派服饰有限公司,广东,广东广州,100 - 499人,私营．民营企业,女装,307
丹比奴（中国）运营中心（蔓哲）,广东,广东广州,100 - 499人,外商独资．外企办事处,"男装, 女装, 鞋业",307
广州东麟服饰有限公司(城.绘),广东,广东广州,100 - 499人,私营．民营企业,女装,307
广州爱递婴童用品有限公司,广东,广东广州,1 - 49人,私营．民营企业,童装,307
广州市泽世服饰有限公司,广东,广东广州,1 - 49人,私营．民营企业,"男装, 女装",307
杭州度耳其时装公司,浙江,浙江杭州,50 - 99人,私营．民营企业,"男装, 女装",307
杭州金娜时装有限公司,浙江,浙江杭州,50 - 99人,私营．民营企业,女装,307
广州世天贸易有限公司,广东,广东广州,50 - 99人,外商独资．外企办事处,女装,308
广州市金琦服饰有限公司,广东,广东广州,100 - 499人,外商独资．外企办事处,女装,308
苏州格瑞服饰有限公司,江苏,江苏苏州,100 - 499人,外商独资．外企办事处,"男装, 女装",308
上海仙贝实业发展有限公司,浙江,浙江嘉兴,100 - 499人,私营．民营企业,"男装, 女装, 内衣, 运动休闲, 职业装",308
南京法诗蒂服饰有限公司,江苏,江苏南京,50 - 99人,私营．民营企业,女装,308
快鱼服饰有限公司,浙江,浙江杭州,1000人以上,私营．民营企业,"男装, 女装, 童装, 运动休闲, 牛仔",308
广州邻家女孩时尚有限公司,广东,广东广州,100 - 499人,私营．民营企业,女装,308
深圳影儿时尚集团有限公司,广东,广东深圳,1000人以上,私营．民营企业,女装,308
象山德昕纺织印花有限公司,浙江,浙江宁波,100 - 499人,私营．民营企业,"男装, 女装, 童装",308
佳达制衣(深圳)有限公司,广东,广东深圳,1000人以上,私营．民营企业,内衣,308
桦洁商贸（上海)有限公司,上海,上海,100 - 499人,外商独资．外企办事处,"鞋业, 箱包",309
深圳市形上服饰设计有限公司,广东,广东深圳,100 - 499人,其它,女装,309
深圳玛丝菲尔噢姆服饰有限公司,广东,广东深圳,100 - 499人,私营．民营企业,女装,309
广州市一涵服装有限公司,广东,广东广州,100 - 499人,外商独资．外企办事处,羽绒服,309
斯得雅（中国）有限公司,北京,北京,,,,309
苏州市新大华泰进出口有限公司,江苏,江苏苏州,100 - 499人,私营．民营企业,"男装, 女装, 运动休闲, 羽绒服",309
鑫英豪服饰有限公司,湖南,湖南株洲,100 - 499人,私营．民营企业,男装,309
东莞达傲丝印有限公司,广东,广东东莞,100 - 499人,港台澳企业,"男装, 女装, 童装, 牛仔, 毛衫针织",309
广州铠琪有限公司(蔓琦）,广东,广东广州,50 - 99人,私营．民营企业,女装,309
东莞市美澳制衣有限公司,广东,广东东莞,100 - 499人,港台澳企业,泳装,309
广东柏堡龙服饰股份有限公司+广州,广东,广东广州,1 - 49人,私营．民营企业,"男装, 运动休闲",310
太仓美事得时装有限公司,江苏,江苏苏州,100 - 499人,私营．民营企业,"运动休闲,泳装,男装,女装,童装",310
湖州搜尚服饰贸易有限公司,浙江,浙江湖州,100 - 499人,私营．民营企业,童装,310
广东新一系实业有限公司,广东,广东广州,500 - 999人,私营．民营企业,"内衣,其他",310
宁波海曙龙升制衣有限公司,浙江,浙江宁波,1000人以上,外商独资．外企办事处,"内衣,运动休闲,泳装,面辅料",310
宁波松永制衣有限公司,浙江,浙江宁波,50 - 99人,私营．民营企业,"女装, 童装",310
深圳市世都实业有限公司,广东,广东深圳,500 - 999人,私营．民营企业,童装,310
武汉太和服饰有限公司,湖北,湖北武汉,500 - 999人,私营．民营企业,女装,310
北京雪丹枝服装服饰有限公司,北京,北京,50 - 99人,私营．民营企业,女装,310
广州市因否服饰有限公司,广东,广东广州,1 - 49人,私营．民营企业,童装,310
常州五月纺织品有限公司,江苏,江苏常州,100 - 499人,中外合营(合资．合作),男装,311
三黄时装(深圳)有限公司(西彦、Anteprima),广东,广东深圳,50 - 99人,外商独资．外企办事处,"女装, 饰品, 其他",311
浙江金凤来制衣有限公司,浙江,浙江湖州,100 - 499人,私营．民营企业,童装,311
杭州叶歌贸易有限公司,浙江,浙江杭州,50 - 99人,私营．民营企业,女装,311
苏州市拉波尼服饰有限公司,江苏,江苏苏州,50 - 99人,私营．民营企业,男装,311
深圳市茜子服饰连锁经营有限公司(SHE’S、KOOL),广东,广东深圳,50 - 99人,私营．民营企业,"女装, 饰品, 其他",311
江苏霞云飞服装有限公司,江苏,江苏无锡,50 - 99人,私营．民营企业,内衣,311
深圳市鸿威华服装有限公司（嘉丝芭法）,广东,广东深圳,1 - 49人,私营．民营企业,女装,311
广东圣约翰服饰股份有限公司,广东,广东广州,100 - 499人,私营．民营企业,男装,311
宁波恒远制衣有限公司,浙江,浙江宁波,1000人以上,外商独资．外企办事处,"男装,正装,运动休闲,职业装",311
浙江慧兰服饰有限公司,浙江,浙江杭州,500 - 999人,私营．民营企业,"女装, 饰品, 毛衫针织, 其他",312
简美诗服装（深圳）有限公司,广东,广东深圳,100 - 499人,港台澳企业,女装,312
深圳市鹏程智尚投资管理有限公司 埃臣,广东,广东深圳,50 - 99人,私营．民营企业,男装,312
广州市狄驰制衣有限公司,广东,广东广州,50 - 99人,私营．民营企业,男装,312
杭州尚品七厘米服饰有限公司,浙江,浙江杭州,100 - 499人,私营．民营企业,"女装, 鞋业, 饰品, 毛衫针织, 羽绒服",312
广州威尔萨斯服饰有限公司(韦罗宾),广东,广东广州,50 - 99人,私营．民营企业,男装,312
江苏恒浩达服装有限公司,江苏,江苏宿迁,1000人以上,港台澳企业,"家纺,其他",312
深圳市丽琪服装设计有限公司,广东,广东深圳,100 - 499人,私营．民营企业,"女装,婚纱礼服,职业装",312
温州中色制衣有限公司,浙江,浙江温州,100 - 499人,私营．民营企业,男装,312
广州初语服装设计有限公司,广东,广东广州,500 - 999人,私营．民营企业,女装,312
广州市凌云工贸有限公司,广东,广东广州,100 - 499人,私营．民营企业,男装,313
广州市润霖贸易有限公司,广东,广东广州,100 - 499人,私营．民营企业,"男装, 女装, 童装",313
广州市无限元素服装有限公司,广东,广东广州,50 - 99人,私营．民营企业,"男装, 女装, 童装, 运动休闲",313
潮州市龙宝集团有限公司-广州办事处,广东,广东广州,1 - 49人,私营．民营企业,女装,313
湖南多喜爱家纺股份有限公司,广东,广东东莞,1000人以上,私营．民营企业,家纺,313
瑞安市艾梅利服装厂,浙江,浙江温州,100 - 499人,私营．民营企业,女装,313
深圳如斯服饰有限公司,广东,广东深圳,50 - 99人,私营．民营企业,女装,313
广州市迪森服装有限公司,广东,广东广州,100 - 499人,私营．民营企业,"男装, 女装, 童装, 牛仔",313
